{
  "version": 7,
  "previousHash": "0000000000000000000000000000000000000000000",
  "hash": "0000000000000000000000000000000000000000000",
  "tx": [
    {
      "ident": "genesis",
      "origin": "0000000000000000000000000000000000000000000",
      "commands": [
        {
          "seq": 1,
          "command": "data",
          "ns": "genesis:init",
          "d": ""
        }
      ],
      "sig": "00000000000000000000000000000000000000000000000000000000000000000000000000000000000000"
    }
  ],
  "height": 1,
  "votes": [
    {
      "origin": "0000000000000000000000000000000000000000000",
      "sig": "00000000000000000000000000000000000000000000000000000000000000000000000000000000000000"
    }
  ]
}
